"ScientificName","CommonName","order_name","family_nam","code","web_redlist","assessment_redlist"
"Potamotrygon signata","","RAJIFORMES","POTAMOTRYGONIDAE","DD","http://www.iucnredlist.org/details/classify/161467/0","http://www.iucnredlist.org/pdflink.161467"
"Notoraja ochroderma","Pale skate, Bleke rog","RAJIFORMES","ARHYNCHOBATIDAE","DD","http://www.iucnredlist.org/details/classify/161559/0","http://www.iucnredlist.org/pdflink.161559"
"Dasyatis margaritella","Pearl stingray, Paarlemoerpijlstaartrog","RAJIFORMES","DASYATIDAE","DD","http://www.iucnredlist.org/details/classify/161520/0","http://www.iucnredlist.org/pdflink.161520"
"Trygonoptera mucosa","Western shovelnose stingaree, Bebil, Kejetuck, Western stingaree, Yellow-spotted stingaree, Australiankiekkorausku, Westelijke doornrog","RAJIFORMES","UROLOPHIDAE","LC","http://www.iucnredlist.org/details/classify/60082/0","http://www.iucnredlist.org/pdflink.60082"
"Orectolobus halei","","ORECTOLOBIFORMES","ORECTOLOBIDAE","LC","http://www.iucnredlist.org/details/classify/161709/0","http://www.iucnredlist.org/pdflink.161709"
"Scymnodalatias albicauda","","SQUALIFORMES","SOMNIOSIDAE","DD","http://www.iucnredlist.org/details/classify/41855/0","http://www.iucnredlist.org/pdflink.41855"
"Amblyraja radiata","morgath bigog, Sternrochen, Sternroche, Starry ray, Maiden ray, Thornback, Thorny back, miller, starry skate, thorny skate, Escrita, Raya radiante, Kynsirausku, Pinnagigga, Amblyraja radiata, Tindaskata, Agdlernak, Kollivsiuternak, Sterrog, Klorokke, Kloskate, Raja promienista, Plaszczka promienista, Raia-repregada, Raia repregada, Vatos spinos, Zvezdchatyi skat, Klorocka","RAJIFORMES","RAJIDAE","VU","http://www.iucnredlist.org/details/classify/161542/0","http://www.iucnredlist.org/pdflink.161542"
"Leucoraja leucosticta","Whitedappled skate, Appelgrauwe rog","RAJIFORMES","RAJIDAE","DD","http://www.iucnredlist.org/details/classify/161685/0","http://www.iucnredlist.org/pdflink.161685"
"Torpedo panthera","Khadala ramlya, Bogenstirn-Torpedorochen, Panther electric ray, Leopard torpedo, Luipaardsidderrog","RAJIFORMES","TORPEDINIDAE","DD","http://www.iucnredlist.org/details/classify/60134/0","http://www.iucnredlist.org/pdflink.60134"
"Urotrygon aspidura","Spiny-tail round ray, Panamic stingray, Roughtail round stingray, Stingray, roundray, Raya, Raya aspera, Raya redonda de cola espinosa, Raya redonda de rabo espinudo, Tapadera, Ruwstaartdoornrog","RAJIFORMES","UROTRYGONIDAE","DD","http://www.iucnredlist.org/details/classify/161689/0","http://www.iucnredlist.org/pdflink.161689"
"Eridacnis radcliffei","Pygmy ribbontail cat shark, Pygmy ribbon tail catshark, pygmy ribbontail catshark, Tollo coludo pigmeo, Eridacnis radcliffei, Dwergrugvinkathaai, Pating","CARCHARHINIFORMES","PROSCYLLIIDAE","LC","http://www.iucnredlist.org/details/classify/161468/0","http://www.iucnredlist.org/pdflink.161468"
"Pteromylaeus bovinus","Pylstert, Bulrog, Falcone, afrikanischer Adlerrochen, Entenschnabelrochen, Gestreifter Adlerrochen, afrikanischer gefleckter Adlerrochen, Rynchaetopsaro, Eagle ray, Bullray, Duckbill, Duckbill ray, bull ray, Chucho, Arzobispo, Chucho vaca, Obispo, Peje obispo, Pez obispo, Juovakotkarausku, Raie aigle, Aigle vachette, Aigle-vachette, Mourine, Mourine vachette, Mourine-vachette, Raie-aigle, Cukan, Golub cukan, Papa, Vascarella, Bugghiu, Colombo, Colombo di mare, Ferraccia, Matan, Muggiu, Nottola, Orineglia, Oxella, Patesse, Stramasso, Tattarita, Tistuni, Vaccarella, Vaccariella, Vacche, Vescovo, Hamiema, Ghasfur, Hamiema rasha twila, Tajra, Vleermuisadelaarsrog, Bispo, Papa, Peixe-bispo, Ratao bovino, Korocka, Folya baligi, Fulya baligi, Ndiaouratt, Ndiaouatt, Soukel","RAJIFORMES","MYLIOBATIDAE","DD","http://www.iucnredlist.org/details/classify/60127/0","http://www.iucnredlist.org/pdflink.60127"
"Hemiscyllium michaeli","","ORECTOLOBIFORMES","HEMISCYLLIIDAE","NT","http://www.iucnredlist.org/details/classify/195438/0","http://www.iucnredlist.org/pdflink.195438"
"Dasyatis fluviorum","Estuary stingray, Estuary stingaree, River stingray, brown stingray, Pari, Pari muara, Estuariumpijlstaartrog, Kraban Hin","RAJIFORMES","DASYATIDAE","VU","http://www.iucnredlist.org/details/classify/41797/0","http://www.iucnredlist.org/pdflink.41797"
"Pristis pristis","Almindelig savrokke, Pristis mikrodontos, Common sawfish, Largetooth sawfish, Sawfish, Small-toothed sawfish, Pez sierra, Pejepeine, Pejesierra, Harmaasaharausku, Poisson-scie commun, Poisson-scie tident, Scie, Scie commune, Pesce sega, Pa salam, Pixxisega, Pixxiserrieq, Sija, Gewone zaagrog, Peixe-serra, Espadarte, Espadarte-serra, Papa upanga, Testere baligi","RAJIFORMES","PRISTIDAE","CR","http://www.iucnredlist.org/details/classify/18584848/0","http://www.iucnredlist.org/pdflink.18584848"
"Malacoraja spinacidermis","Rog, Ruwevel-rog, Lodden rokke, Samthautrochen, Skate, Prickled ray, Prickled skate, Roughskin skate, soft skate, Raie molle, Raie mollette, Sjafnarskata, Stekelhuidrog","RAJIFORMES","RAJIDAE","LC","http://www.iucnredlist.org/details/classify/63126/0","http://www.iucnredlist.org/pdflink.63126"
"Zameus squamulosus","Samtdornhai, velvet dogfish, Smallmouth knifetooth dogfish, smallmouth velvet dogfish, Bruja terciopelo, Bruja boca chica, Bruja bocachica, Hiu beurit, Fluweelijshaai, Areganhada-de-focinho-comprido, Svarthaj","SQUALIFORMES","SOMNIOSIDAE","DD","http://www.iucnredlist.org/details/classify/60215/0","http://www.iucnredlist.org/pdflink.60215"
"Amblyraja hyperborea","Arktisk rokke, Arktischer Rochen, Arctic skate, Blackbelly skate, Boreal skate, Darkbelly skate, Northern skate, artic skate, Eisrochen, Raie arctique, Arctische rog, Isskate, Raja polarna, Isrocka","RAJIFORMES","RAJIDAE","LC","http://www.iucnredlist.org/details/classify/63119/0","http://www.iucnredlist.org/pdflink.63119"
"Himantura fai","Pink whipray, Pink whip ray, Ruususiimarausku, tina ni vai, vai buli, Raie fouet, Pari, Pari pucat, Lila pijlstaartrog, Kraban Hin, Fai","RAJIFORMES","DASYATIDAE","LC","http://www.iucnredlist.org/details/classify/161615/0","http://www.iucnredlist.org/pdflink.161615"
"Mustelus manazo","Stjerneplettet glathaj, Spotted shark, Gummy dogfish, Gummy shark, Hound shark, Japanese smooth hound, Star-spotted gummy shark, Star-spotted shark, Star-spotted smooth hound, Starsoptted smooth-hound, starspotted smooth-hound, topes, Musola celestial, Hoshizame, Pyol-sang-o, Kajari magar, Yu jaras, Yu-jaras bintik, Stervlektoonhaai, Caneja, Sobach'ya, Mangra, Pal sorrah","CARCHARHINIFORMES","TRIAKIDAE","DD","http://www.iucnredlist.org/details/classify/161633/0","http://www.iucnredlist.org/pdflink.161633"
"Hydrolagus purpurescens","Lilla havmus, Ratfish, Purple ghostshark, purple chimaera, Murasaki-ginzame","CHIMAERIFORMES","CHIMAERIDAE","DD","http://www.iucnredlist.org/details/classify/60196/0","http://www.iucnredlist.org/pdflink.60196"
"Sinobatis melanosoma","Blackbodied leg skate, Blackbodied legskate, Zwartlijfpootrog","RAJIFORMES","ANACANTHOBATIDAE","LC","http://www.iucnredlist.org/details/classify/161358/0","http://www.iucnredlist.org/pdflink.161358"
"Okamejei meerdervoortii","Bigeye skate, Medamakasube, Grootoogrog","RAJIFORMES","RAJIDAE","DD","http://www.iucnredlist.org/details/classify/161487/0","http://www.iucnredlist.org/pdflink.161487"
"Schroederichthys bivius","narrowmouthed catshark, Narrowmouth cat shark, Narrowmouth catshark, Pintarroja, Pejegato bocachica, Holbiche blanche, Streepbekkathaai","CARCHARHINIFORMES","SCYLIORHINIDAE","DD","http://www.iucnredlist.org/details/classify/39347/0","http://www.iucnredlist.org/pdflink.39347"
"Rhinoraja albomaculata","","RAJIFORMES","ARHYNCHOBATIDAE","VU","http://www.iucnredlist.org/details/classify/63102/0","http://www.iucnredlist.org/pdflink.63102"
"Centrophorus tessellatus","Mosaic gulper shark, Mosaic dogfish, Quelvacho mosaico, Genrokuzame","SQUALIFORMES","CENTROPHORIDAE","DD","http://www.iucnredlist.org/details/classify/60208/0","http://www.iucnredlist.org/pdflink.60208"
"Gurgesiella atlantica","Atlantic pygmy skate, Oppo-kasube, Atlantische dwergrog","RAJIFORMES","RAJIDAE","DD","http://www.iucnredlist.org/details/classify/63161/0","http://www.iucnredlist.org/pdflink.63161"
"Narcine vermiculatus","Vermiculate electric ray, Vermiculated electric ray, Wormy electric ray, electric-ray, Wormstekige stroomrog","RAJIFORMES","NARCINIDAE","NT","http://www.iucnredlist.org/details/classify/161423/0","http://www.iucnredlist.org/pdflink.161423"
"Squalus grahami","","SQUALIFORMES","SQUALIDAE","NT","http://www.iucnredlist.org/details/classify/42727/0","http://www.iucnredlist.org/pdflink.42727"
"Dipturus apricus","","RAJIFORMES","RAJIDAE","LC","http://www.iucnredlist.org/details/classify/195445/0","http://www.iucnredlist.org/pdflink.195445"
"Rhinobatos ocellatus","Spikkel-sandkruiper, Speckled guitarfish, Gespikkelde gitaarrog","RAJIFORMES","RHINOBATIDAE","DD","http://www.iucnredlist.org/details/classify/161697/0","http://www.iucnredlist.org/pdflink.161697"
"Narke capensis","Eenvin-drilvis, Kap-elrokke, Cape numbfish, Onefin electric ray, Pez temblador del Cabo, Poisson engourdeur du Cap, Eenvinsluimerrog","RAJIFORMES","NARKIDAE","DD","http://www.iucnredlist.org/details/classify/161614/0","http://www.iucnredlist.org/pdflink.161614"
"Raja brachyura","Rajada de boca rosa, Rajada rosa, morgath felen, Blond rokke, Blonde, Blondrochen, Xanthovatos, Blonde skate, Blond ray, Blonde, blonde ray, Raya, Boca de rosa, Escrita, Raia braquiura, Raya boca de rosa, Raya braquiura, Pilkkurausku, Raie blanche, Raie blanche douce, Raie lisse, Skata, Razza a coda corta, Pichira schizzata, Blonde de ray, Blonde rog, Prikkrokke, Prikkskate, Raja bialoplama, Raia, Arraia, Raia pontuada, Raia-pontuada, Raza, Skata, Ljus rocka, Ljusa rockan","RAJIFORMES","RAJIDAE","NT","http://www.iucnredlist.org/details/classify/161691/0","http://www.iucnredlist.org/pdflink.161691"
"Torpedo nobiliana","Atlantiese drilvis, Vaca negrosa, Vaca negra, Tremula nera, morgath drydan, Elektrisk rokke, Sort elektrisk rokke, Sort elrokke, Zitterroche, Dunkler Zitterrochen, Schwarzer zitterrochen, Zitterrochen, Mavromoudiastra, Electric ray, Atlantic New British torpedo, Atlantic electric ray, Atlantic torpedo, Black torpedo, Crampfish, Dark electric ray, Electricfish, Great Torpedo Ray, Great torpedo, Numbfish, Torpedo, Temblador de mar, Esturpillo, Temblaera, Torpedo de lo alto, Tremblador negro, Tremolina negra, Trimielga negra, Vaca temblaera, Torpedinidae, Torpille, Torpille noire, Drhtulja, Torpedine nera, Sgranfo, Tremolo grando, Tremula 'mpiriale, Tremula nira, Anko-shibire-ei, Haddiela mdahhna, Haddiela samra, Haddiela sewda, Sidderrog, Elektrieke rog, Zwarte sidderrog, Dretwa brunatna, Raia, Arrraia, Torpedo, Tremelga, Tremelga-negra, Peste torpila, Darrocka, Elektrik baligi, Uyusturan balik","RAJIFORMES","TORPEDINIDAE","DD","http://www.iucnredlist.org/details/classify/161580/0","http://www.iucnredlist.org/pdflink.161580"
"Benthobatis moresbyi","Dark blind ray, Dark blindray, Donkere blinde stroomrog","RAJIFORMES","NARCINIDAE","DD","http://www.iucnredlist.org/details/classify/161349/0","http://www.iucnredlist.org/pdflink.161349"
"Psammobatis rudis","Smallthorn sand skate, Ray, Smallthorn sandskate, Raya hocico blanco, Kleinstekelzandrog","RAJIFORMES","ARHYNCHOBATIDAE","DD","http://www.iucnredlist.org/details/classify/44641/0","http://www.iucnredlist.org/pdflink.44641"
"Bathyraja richardsoni","Richardsons Tiefenrochen, Richardson's ray, Richardson's skate, Richardsons ray, Richardsons skate, deepsea skate, deepwater skate, Raya de Richardson, Raie de Richardson","RAJIFORMES","ARHYNCHOBATIDAE","LC","http://www.iucnredlist.org/details/classify/63127/0","http://www.iucnredlist.org/pdflink.63127"
"Mobula mobular","Mantellina, Manta, Diavulu di mare, Vacca di mare, Teufelsrochen, Atlantischer Teufelsrochen, Kleiner Teufelsroche, Kleiner Teufelsrochen, Meeresteufel, Mittelmeer-Manta, Diavolopsaro, devilfish, Devil fish, Devil ray, Giant devil ray, Giant devilray, Horny ray, Manta, Manta, Manta mobula, Maroma, Sarvirausku, Mante, Diable de mer, Manta, Golub uhan, Diavolo di mare, Daddarita, Manta, Mobula, Muchio vacca, Patesse addo capre, Pesce vesque, Pescio vacca, Pipistrello, Pisci daddarita, Pisci sceccu, Vacca 'emare, Vescovo, Shing pakat, Manta, Baqra, Raja tal-qrun, Kleine dulvelsrog, Duivelsrog, Kleine duivelsrog, Mobula, Manta, Diabo-do-mar, Jamanta, Jimanta, Maroma, Ugemanta, Uja, Uje, Urjamanta, Diavol de mare, Lope deti, djalli i detit, lopa e detit, Manta, Kulaklifulya baligi, Seytan baligi","RAJIFORMES","MOBULIDAE","EN","http://www.iucnredlist.org/details/classify/39418/0","http://www.iucnredlist.org/pdflink.39418"
"Halaelurus quagga","Quagga cat shark, quagga catshark, Pejegato quagga, Seeprakissahai, Holbiche quagga, Quaggakathaai","CARCHARHINIFORMES","SCYLIORHINIDAE","DD","http://www.iucnredlist.org/details/classify/161625/0","http://www.iucnredlist.org/pdflink.161625"
"Zanobatus schoenleinii","Schoenleins Geigenrochen, Geigenrochen, Sand-Geigenrochen, Striped panray, Raja de Altura, Seeprabanjorausku, raie ronde, Gestreepte panrog, Afrikaanse panrog, Raia-do-alto, Arraia, Raia-de-altura, Lalan","RAJIFORMES","ZANOBATIDAE","DD","http://www.iucnredlist.org/details/classify/161519/0","http://www.iucnredlist.org/pdflink.161519"
"Breviraja nigriventralis","","RAJIFORMES","RAJIDAE","DD","http://www.iucnredlist.org/details/classify/161422/0","http://www.iucnredlist.org/pdflink.161422"
"Okamejei philipi","","RAJIFORMES","RAJIDAE","DD","http://www.iucnredlist.org/details/classify/161493/0","http://www.iucnredlist.org/pdflink.161493"
"Oxynotus japonicus","Japanese roughshark, Oroshi zame, Japanse ruwhaai","SQUALIFORMES","OXYNOTIDAE","DD","http://www.iucnredlist.org/details/classify/44206/0","http://www.iucnredlist.org/pdflink.44206"
"Himantura uarnak","Heuningkoek-pylstert, Lukhmah, Lakhman, Ruget, Shankar-machh, Leopard-Stechrochen, Imantoura, Longtail stingray, Banded whiptail stingray, Coachwhip ray, Honeycomb, Honeycomb ray, Honeycomb stingray, Honeycombed stingray, Leopard ray, Leopard stingray, Longtail ray, Longtailed ray, Lontail ray, Marbled sting ray, Marbled stingray, Reticulate whip ray, Reticulate whipray, Reticulated whipray, Whiptail ray, Whiptail stingray, honeycomb whipray, Chupare oval, Pow-e-palangy, Leopardisiimarausku, Bouchee, Himantura, Pastenague indienne, Pastenague nid d'abeille, Raie blanche, Raie bouclee, Boor, Tarabla, Warkhol Patari, Hyomon-otome ei, Pari macan, Belya, Thirandi, Bhatya, Waghya-pakat, Whaghya pakat, Pari tanjung, Pari, Pari batik, Pari beting, Pari bunga, Pari bunga/batik, Pari kelawar, Pari pasir, Pari rimau, Leik-kyauk-hua-maungdo, Luipaardpijlstaartrog, Sankush, Shankar, Ogoncza arnak, Vali maduva, Shafane shabeellow, Manal thirukai, Pulli-thirukkai, Sona-kah-tirike, Pulli-thirukkai, Puli-tenke, Sona-kah-tirike, Krabane Lai-mang-won, Pagi, Paging bulik, Paging dahunan, Paging sulatan, Tirpana baligi","RAJIFORMES","DASYATIDAE","VU","http://www.iucnredlist.org/details/classify/161692/0","http://www.iucnredlist.org/pdflink.161692"
"Leucoraja lentiginosa","Freckled skate, speckled skate, raya pecosa, Sproetrog","RAJIFORMES","RAJIDAE","DD","http://www.iucnredlist.org/details/classify/161318/0","http://www.iucnredlist.org/pdflink.161318"
"Okamejei powelli","Indian ringed skate, Indische ringrog","RAJIFORMES","RAJIDAE","DD","http://www.iucnredlist.org/details/classify/161548/0","http://www.iucnredlist.org/pdflink.161548"
"Holohalaelurus regani","","CARCHARHINIFORMES","SCYLIORHINIDAE","LC","http://www.iucnredlist.org/details/classify/161574/0","http://www.iucnredlist.org/pdflink.161574"
"Aulohalaelurus labiosus","Black-spotted cat shark, Australian Blackspot catshark, Australian blackspotted catshark, Black spotted catshark, Black-spotted catshark, Blackspotted catshark, Pejegato estrellado, Huulikissahai, Hiu dolong, Zwartgevlekte kathaai","CARCHARHINIFORMES","SCYLIORHINIDAE","LC","http://www.iucnredlist.org/details/classify/41731/0","http://www.iucnredlist.org/pdflink.41731"
"Urolophus kapalensis","","RAJIFORMES","UROLOPHIDAE","NT","http://www.iucnredlist.org/details/classify/42730/0","http://www.iucnredlist.org/pdflink.42730"
"Neoharriotta pumila","Arabian sicklefin chimaera","CHIMAERIFORMES","RHINOCHIMAERIDAE","DD","http://www.iucnredlist.org/details/classify/60143/0","http://www.iucnredlist.org/pdflink.60143"
"Urobatis halleri","","RAJIFORMES","UROTRYGONIDAE","LC","http://www.iucnredlist.org/details/classify/60108/0","http://www.iucnredlist.org/pdflink.60108"
"Alopias pelagicus","Grootoog-sambokhaai, Kleintand-sambokhaai, Akno, Indopazifischer Fuchshai, Big-eye shark, Fox shark, Pelagic thresher, Small tooth thresher shark, Smalltooth thresher, Smalltooth thresher shark, Thresher, Thresher shark, Whiptail shark, pelagic thresher shark, Pejerrabo, Alopias superciliosus, Tiburon zorro, Zorro de mar, Kooseh-e-derazdom, Ulappakettuhai, Karibiankettuhai, Renard de mer, Requin renard, Requin-renard, Mano hi'uka, Mano laukahi'u, Pesce volpe occhio grosso, Squalo volpe pelagico, Hachiware, Nitari, Hwan-do-sang-o, Yu ekor panjang, Terng boi suar, Yu tikus, Grootoogvoshaai, Pelagische voshaai, Voshaai, Peixe-raposo, Chalarm hang-daab","LAMNIFORMES","ALOPIIDAE","VU","http://www.iucnredlist.org/details/classify/161597/0","http://www.iucnredlist.org/pdflink.161597"
"Pavoraja umbrosa","","RAJIFORMES","ARHYNCHOBATIDAE","LC","http://www.iucnredlist.org/details/classify/70681387/0","http://www.iucnredlist.org/pdflink.70681387"
"Squalus blainville","Irsh, Malka kuceska akula, Agullat xato, Blainvilles pighaj, Blainvilles doornhaai, Blainville-Dornhai, Blainvilles Dornhaai, Blainvilles Dornhai, Langnasen-Dornhai, Grisokentroni, Grozokentroni, Kocalas, Longnose spurdog, Bigeye dogfish, Blainville's dogfish, Dogfish, Long-nose spurdog, Longnose dogshark, Galludo, Pinchuo, Nokkapiikkihai, Squalus blainville, Aiguillat coq, Aiguillat galludo, Aiguillat galudo, Aiguillat-coq, Kotsan caton, Qozan mazuz, Kostelj, Kostilj, Spinarolo, Spinarolo bruno, Hiretakatsunozame, Mazzola tax-xewka, Mazzola biz-xewka, Tax-xewka, Ujatu, Galhudo, Ferranho, Galhudo-cubano, Malaya kucheshka akula, Peshkagen dy gjilperesh, Peshkaqeni dyshtizash, Pas kostelj, Kostilj, Kostily, Galludohaj, Nguindagne, Thiour","SQUALIFORMES","SQUALIDAE","DD","http://www.iucnredlist.org/details/classify/161536/0","http://www.iucnredlist.org/pdflink.161536"
"Glaucostegus granulatus","Barbar, Ehreey, Fanto, Hangor, Shank armachh, Geigenrochen, Sharpnose guitarfish, Granulated guitarfish, Granulated shovel-nose ray, Granulated shovelnose ray, Rough shovelnose ray, Slough fish, Bhuther, Dhons, Vanthala, Lanj, Pok, Ranja, Pari pandrong, Scherpsnuitgitaarrog, kair, Cundaree, Sherol, Bal oliya, Gal uluva, Kal uluvai, Padangan, Purrungan","RAJIFORMES","RHINOBATIDAE","VU","http://www.iucnredlist.org/details/classify/60166/0","http://www.iucnredlist.org/pdflink.60166"
"Cephaloscyllium silasi","Indisk ballonhaj, Indian swellshark, Indian swell shark, Pejegato de Silas, Holbiche indienne, Indiase zwelhaai","CARCHARHINIFORMES","SCYLIORHINIDAE","DD","http://www.iucnredlist.org/details/classify/161591/0","http://www.iucnredlist.org/pdflink.161591"
"Rajella bathyphila","Dybhavsrokke, Tiefwasseerrochen, Deepwater ray, Deep-water ray, abyssal skate, chocolate skate, deepwater skate, Raya profunda, Raie bathyale, Diepwaterrog","RAJIFORMES","RAJIDAE","LC","http://www.iucnredlist.org/details/classify/161345/0","http://www.iucnredlist.org/pdflink.161345"
"Isurus paucus","Langvin-mako, Makrelhaj, Langfinnet mako, Langfinnet makohaj, Langflossen-Mako, Langflossen-Makohai, Langflossen-Makoo, Makohai, longfin mako, Long-fin mako, Longfinned mako shark, Mako, longfin mako shark, longfish mako, Dientuso prieto, marrajo carite, Makohai, Isurus paucus, Petit requin-taupe, Petite requin taupe, Petite taupe, petit taupe, taupe longue aile, Smeriglio mako, Bake-aozame, Jerung, Jerung-mako sirip panjang, Langvinmakreelhaai, Ostronos dlugopletwy, Anequim-preto","LAMNIFORMES","LAMNIDAE","VU","http://www.iucnredlist.org/details/classify/60225/0","http://www.iucnredlist.org/pdflink.60225"
"Anoxypristis cuspidata","Abusef, Sayyafah, Knivtandet savrokke, Karati hangar, Narrow sawfish, Pointed saw-fish, Pointed sawfish, Saw fish, Saw shark, Sawfish, knifetooth sawfish, Pez espada, Pejepeine, Pez sierra, Puukkosaharausku, Poisson-scie, Chhurio, Veher, Nokogiri-ei, Cucut krakas, Mungsing prampang, Pamprang, Pamprang, Parangpang, Pemprang, Prompran, Parangpang, Pemprang, Prompran, Billi sovulu, Chakku thatte, Naithatte, Makara sravu, Makarasravu, Vala sravu, Velli sravi, Nali, Win, shinavale, Yu parang, Beroi, Cucut gergaji, Kan sua, Pamprang, Parangpang, Pari-gergaji jarang, Pemprang, Prompran, Yu beroi, Yu gergaji, Yu todak, Mestandzaagrog, Vela, Iluppa, Hachutti meenu, Shinesi","RAJIFORMES","PRISTIDAE","EN","http://www.iucnredlist.org/details/classify/39389/0","http://www.iucnredlist.org/pdflink.39389"
"Scymnodalatias oligodon","","SQUALIFORMES","SOMNIOSIDAE","DD","http://www.iucnredlist.org/details/classify/44570/0","http://www.iucnredlist.org/pdflink.44570"
"Proscyllium habereri","P'yo-bom-sang-o, Graceful cat shark, Haberer's catshark, graceful catshark, Nauhahai, Proscyllium habereri, Requin chat gracile, Requin-chat gracile, Taiwanzame, Elegante rugvinkathaai","CARCHARHINIFORMES","PROSCYLLIIDAE","DD","http://www.iucnredlist.org/details/classify/161733/0","http://www.iucnredlist.org/pdflink.161733"
"Carcharhinus longimanus","Opesee-wittiphaai, Hvidtippet haj, Langflossen-Hai, Oceanic white-tip shark, Brown Milbert's sand bar shark, Brown shark, Nigano shark, Ocean whitetip shark, Oceanic white tip shark, Oceanic white-tipped whaler, Shark, White-tip shark, White-tipped shark, Whitetip, Whitetip oceanic shark, Whitetip shark, Whitetip whaler, oceanic whitetip shark, silvertip shark, Carcharhinus longimanus, Galano, Tiburon oceanico, Valkopilkkahai, Requin longimane, Aileron blanc du large, Rameur, Requin blanc, Requin canal, Mano, Carcharhinus longimanus, Squalo alalunga, Yogore, Hiu koboy, Cucut koboy, ilgapelekis pilkasis ryklys, Meso, Ikan yu, Yu, Yu sirip bulat putih, Oceanische witpunthaai, Witpunthaai, Zarlacz bialopletwy, Galha-branca, Marracho, Marracho-de-pontas-brancas, Polkola mora, Apoapo, Pating, Akyuzgecli kopekbaligi, Parata","CARCHARHINIFORMES","CARCHARHINIDAE","VU","http://www.iucnredlist.org/details/classify/39374/0","http://www.iucnredlist.org/pdflink.39374"
"Rhinobatos rhinobatos","Mourr, Guitarra, Chiterra, Almindelig guitarfisk, Glattrochen, Geigenrochen, Hairochen, gemeiner Geigenrochen, Rinovatos, Common guitarfish, Common violinfish, Guitarfish, Lengthened shape, Manta, Mediterranean longnose, Violinfish, common mediterranean guitarfish, Rebeca, Guitarra, Manta, Picudos, Viola, Kitararausku, Guitare, Guitare de mer commune, Poisson-guitare commun, Raie-guitare commune, Rhinobate commun, Violon de mer, Pesce chitarra, Calascione, Catarre, Chetarre, Galascioene, Mandolino, Pesce violino, Pesce viuline, Pesciu chitara, Pisci chitarra, Pisci viulinu, Quatra viuline, Squadre, Squadru monicu, Squotre, Viulinu, Rebekkin, Vjolin, Gewone gitaarrog, Gewone vioolrog, Rocha, Viola, Cassapai, Guitarra, Rabeca, Raia-de-altura, Raia-do-alto, Uzunkeler baligi, Thiaukher","RAJIFORMES","RHINOBATIDAE","EN","http://www.iucnredlist.org/details/classify/63131/0","http://www.iucnredlist.org/pdflink.63131"
"Prionace glauca","Blouhaai, Kalb al bhar, Mouch labhar, Qarsh Mizraqq, mord'hast, morghi glas, Tintorera, Canesca, Pesciu canu, morgi glas, Blaahaj, Blauhai, blauer Hai, Carcharias, Glafkcarcharias, Glafkokarcharias, Glaukos, Karcharias, Blue shark, Blue dog, Blue poninter, Blue whaler, Blue whaler shark, Great blue, Great blue shark, Great blue whaler, Shark, Tribon blou, lija, Aquella, Azujelo, Ca-mari, Caila, Chiri, Chirimoya, Melgacho, Melgago, Quella, Sarda, Tiburon azul, Tintoleta, Tintorera, Tintorera-marrajo, Verdemar, azulejo, Sinihai, Sarda, Bleu, Cagnot, Cagnou, Empereur, Peau bleu, Requin bleu, Peau bleue, Pei can, Requin bleu, Requin peau bleue, Requin peau-bleue, Requin squale, Requin tchi, Tintourella, Verdoun, Siorc gorm, An siorc gorm, Karish kakhol, Modrulj, hajkulja, Squalo azzurro, Cacciutieddu de mari, Cagna, Cagnizza blu, Cagnoleto, Calandruni, Can da denti, Can turchin, Cane, Canesca, Celeste, Cialandruni, Cialestru, Gialestru, Moretta da denti, Musiedde, Smerije, Squalo verdesca, Verdalrola, Verdarolo, Verdesca, Verdone, Verdoro, Verdun, Virdeddru, Virdeddu, Virdisca, Virdiscu, can, squalo azzuro, Yoshikirizame, Hiu lalaek, Cucut selendang, Melsvasis ryklys, Mango-pounamu, Pounamu, Poutini, Jerung biru, Yu, Kelb il-bahar, Huta Kahla, Blauwe haai, Blauwehaai, Blaahai, Zarlacz blekitny, Pas modrulj, Bico-doce, Focinhudo, Guelha, Guelha azul, Lombo-preto, Mole-mole, Quelha, Tintureira, Tintureiro, Rechin albastru, Sinyaya akula, Seeni mora, Hudja mora, sinji morski pes, Malie, Aso-polota, Peshkagen, Peshkagen jeshil, Peshkaqen jeshil, peshkaqeni blu, peshkaqeni jeshil, Pas modrulj, Ajkula, Hajkula, Hajriba, Zupka, plava ajkula, Blahaj, Pating, Canavar balik, Mavi kopekbaligi, Pamuk baligi, Mao iri moana","CARCHARHINIFORMES","CARCHARHINIDAE","NT","http://www.iucnredlist.org/details/classify/39381/0","http://www.iucnredlist.org/pdflink.39381"
"Atlantoraja castelnaui","Ray, Spotback skate, Raya a lunares, Raia-chita, Raia-jereba, Raya chita, Raya pintada, Rugvlekrog, Arraia-pintada, Arraia-chita, Chita, Raia-chita, Raia-pintada","RAJIFORMES","ARHYNCHOBATIDAE","EN","http://www.iucnredlist.org/details/classify/44575/0","http://www.iucnredlist.org/pdflink.44575"
"Paratrygon ajereba","","RAJIFORMES","POTAMOTRYGONIDAE","DD","http://www.iucnredlist.org/details/classify/161588/0","http://www.iucnredlist.org/pdflink.161588"
"Bathyraja maculata","White-blotched skate, whiteblotched skate, Witgevlekte rog","RAJIFORMES","ARHYNCHOBATIDAE","LC","http://www.iucnredlist.org/details/classify/161350/0","http://www.iucnredlist.org/pdflink.161350"
