"ScientificName","CommonName","order_name","family_nam","code","web_redlist","assessment_redlist"
"Trygonoptera testacea","Stingray, Common stingaree, stingaree, Gewone doornrog","RAJIFORMES","UROLOPHIDAE","LC","http://www.iucnredlist.org/details/classify/60085/0","http://www.iucnredlist.org/pdflink.60085"
"Dasyatis guttata","Longnose stingray, Stingray, longnose sting ray, Raya, Hocicona, Raya blanca, Raya hocicona, Raya latigo hocicona, rayalatigo hocicona, Dasyatis guttata, Pastenague longnez, Zarazara-ei, Stekelrog, Langsnuitpijlstaartrog, Raia, Arraia, Arraia branca, Arraia-bico-de-remo, Arraia-bicuda, Arraia-lixa, Raia-branca, Raia-lixa, Raia-lixo","RAJIFORMES","DASYATIDAE","DD","http://www.iucnredlist.org/details/classify/44592/0","http://www.iucnredlist.org/pdflink.44592"
"Apristurus platyrhynchus","Flatnose cat shark, Bigfin catshark, Borneo cat shark, Flatnose catshark, Spatula catshark, Spatulasnout cat shark, borneo catshark, spatulasnout catshark, Pejegato espatulado, Pejegato de Borneo, Holbiche spatule, Holbiche malaise, Holbiche spatula, Herazame, Vlaksnuitkathaai, Borneokathaai, Spatelsnuitkathaai","CARCHARHINIFORMES","SCYLIORHINIDAE","LC","http://www.iucnredlist.org/details/classify/44223/0","http://www.iucnredlist.org/pdflink.44223"
"Iago garricki","Longnose hound shark, longnose houndshark, Iago garricki, Hiu karang, Karil, Langsnuitvaalhaai","CARCHARHINIFORMES","TRIAKIDAE","LC","http://www.iucnredlist.org/details/classify/41829/0","http://www.iucnredlist.org/pdflink.41829"
"Pastinachus solocirostris","","RAJIFORMES","DASYATIDAE","EN","http://www.iucnredlist.org/details/classify/161465/0","http://www.iucnredlist.org/pdflink.161465"
"Heterodontus ramalheira","Mosambiekse bulkophaai, Hvidplettet hornhaj, Mozambique bullhead shark, White-spotted bullhead shark, heterodontus zebra, whitespotted bullhead shark, zebra bullhead shark, requin dormeur chabot, Witgestippelde stierkophaai","HETERODONTIFORMES","HETERODONTIDAE","DD","http://www.iucnredlist.org/details/classify/44614/0","http://www.iucnredlist.org/pdflink.44614"
"Paragaleus tengi","Straighttooth weasel shark, straight-tooth weasel shark, Comadreja coluda, Paragaleus tengi, Milandre belette, Ten-ibara zame, Yu, Yu gigi lurus, Rechttandwezelhaai, Chalarm Noo","CARCHARHINIFORMES","HEMIGALEIDAE","DD","http://www.iucnredlist.org/details/classify/161543/0","http://www.iucnredlist.org/pdflink.161543"
"Rhinobatos irvinei","Pilohrbet Irvinuv, Rejnokovec Irvineuv, Pigrygget guitarfisk, Spineback guitarfish, Irvine guitarra, Raie-guitare dirvine, Stekelruggitaarrog","RAJIFORMES","RHINOBATIDAE","VU","http://www.iucnredlist.org/details/classify/161409/0","http://www.iucnredlist.org/pdflink.161409"
"Squatina argentina","Argentinsk havengel, Argentine angelshark, Argentine angel shark, Argentine angelfish, Longfin angel shark, longfin angelshark, Angelote argentino, Angelito, Angelote, Squatina argentina, Ange de mer argentin, Argentijnse zee-engel, Anjo, Anjo-do-mar, Peixe-anjo","SQUATINIFORMES","SQUATINIDAE","EN","http://www.iucnredlist.org/details/classify/39329/0","http://www.iucnredlist.org/pdflink.39329"
"Dasyatis matsubarai","Trnucha Matsubara, Pitted stingray, Hoshi-ei, Pokdalige pijlstaartrog","RAJIFORMES","DASYATIDAE","DD","http://www.iucnredlist.org/details/classify/161671/0","http://www.iucnredlist.org/pdflink.161671"
"Leptocharias smithii","Baard-hondhaai, Taess, Smiths Schlankhai, Barbelled houndshark, Barbeled hound shark, barbeled houndshark, Marajo, Gallo, Hiirihai, Requin, Chien de mer roux, Emissole barbue, Voeldraadhondshaai","CARCHARHINIFORMES","LEPTOCHARIIDAE","NT","http://www.iucnredlist.org/details/classify/39350/0","http://www.iucnredlist.org/pdflink.39350"
"Parmaturus xaniurus","Filetail catshark, Catshark, filetail cat shark, Gato lima, Pejegato lima, Tummavelttohai, Parmaturus xaniurus","CARCHARHINIFORMES","SCYLIORHINIDAE","LC","http://www.iucnredlist.org/details/classify/60231/0","http://www.iucnredlist.org/pdflink.60231"
"Carcharhinus obscurus","Donkerhaai, Blauhai, Dunkelhai, Grauhai, Sandbankhai, Schwarzhai, Karcharynos skotinochromos, dusky shark, Bay-shark, Black whaler, Black whaler shark, Bronze shark whaler, Bronze whaler, Brown common gray shark, Brown dusky shark, Brown shark, Common whaler, Common whaler shark, Dusky ground shark, Dusky whaler, Requin obscur, River whaler, Shark, Shovelnose, Slender whaler shark, Whaler shark, Lamia, Arenero, Jaqueta, Lobo, Melgacho, Tintorera, Zarco, tiburon arenero, Sumuhai, Carcharhinus obscurus, Rechin, Requiem de sable, Requin, Requin de sable, Requin obscur, Requin obscure, Requin sombre, Squalo scuro, Squalo grigio, Dotabuka, Cucut lanjaman, Hiu lanyam, baltapelekis pilkasis ryklys, Foty, Schemerhaai, Fidalgo, Estrela, Faqueta, Lobo, Marracho areneiro, Marracho-faqueta","CARCHARHINIFORMES","CARCHARHINIDAE","VU","http://www.iucnredlist.org/details/classify/3852/0","http://www.iucnredlist.org/pdflink.3852"
"Apristurus laurussonii","Island-Tiefwasserkatzenhai, Atlantic ghost catshark, Atlantic ghost cat shark, Cat shark, Flathead cat shark, Iceland cat shark, Iceland catshark, Icelandic catshark, Madeira catshark, Medeira shark, flathead catshark, Pejegato de Madera, Pejegato islandico, Islanninkissahai, Apristurus laurussonii, Holbiche atlantique, Roussette d'Islande, Atlantische spookkathaai, Ijslandse kathaai","CARCHARHINIFORMES","SCYLIORHINIDAE","DD","http://www.iucnredlist.org/details/classify/44216/0","http://www.iucnredlist.org/pdflink.44216"
"Cirrhigaleus australis","","SQUALIFORMES","SQUALIDAE","DD","http://www.iucnredlist.org/details/classify/161321/0","http://www.iucnredlist.org/pdflink.161321"
"Carcharhinus altimus","Grootneushaai, Storsnudet haj, Karcharinos megalorynchos, Knopp's shark, Shark, bignose shark, Baboso, Picoto, Isokuonohai, Requin babosse, Requin-babosse, Mano, Squalo naso grande, Grootsnuithaai, Marracho baboso","CARCHARHINIFORMES","CARCHARHINIDAE","DD","http://www.iucnredlist.org/details/classify/161564/0","http://www.iucnredlist.org/pdflink.161564"
"Mustelus henlei","Brun glathaj, Brown smooth-hound, Brown smooth hound, Smoothhound, brown smoothhound, Musola parda, Ruskokoirahai, Mustelus henlei, Emissole brune, Bruine toonhaai","CARCHARHINIFORMES","TRIAKIDAE","LC","http://www.iucnredlist.org/details/classify/161648/0","http://www.iucnredlist.org/pdflink.161648"
"Apristurus sibogae","pale catshark, Pale cat shark, Pale catshark pale catshark, Pejegato paliducho, Bleke kathaai","CARCHARHINIFORMES","SCYLIORHINIDAE","DD","http://www.iucnredlist.org/details/classify/161672/0","http://www.iucnredlist.org/pdflink.161672"
"Parascyllium elongatum","","ORECTOLOBIFORMES","PARASCYLLIIDAE","DD","http://www.iucnredlist.org/details/classify/195440/0","http://www.iucnredlist.org/pdflink.195440"
"Bathyraja aguja","Aguja skate, Agujarog","RAJIFORMES","ARHYNCHOBATIDAE","DD","http://www.iucnredlist.org/details/classify/61399/0","http://www.iucnredlist.org/pdflink.61399"
"Pliotrema warreni","Seskief-saaghaai, sixgill sawshark, Harmaasahahai, Requin scie flutian, Requin scie flutien, Zeskieuwszaaghaai","PRISTIOPHORIFORMES","PRISTIOPHORIDAE","NT","http://www.iucnredlist.org/details/classify/44496/0","http://www.iucnredlist.org/pdflink.44496"
"Cruriraja cadenati","","RAJIFORMES","ANACANTHOBATIDAE","DD","http://www.iucnredlist.org/details/classify/161374/0","http://www.iucnredlist.org/pdflink.161374"
"Dipturus leptocaudus","","RAJIFORMES","RAJIDAE","DD","http://www.iucnredlist.org/details/classify/44644/0","http://www.iucnredlist.org/pdflink.44644"
"Rhizoprionodon taylori","Australsk spidssnudet haj, Australian sharpnose shark, Sharp-nosed shark, Taylor's shark, Taylors shark, Yu muncung kelabu, Australische scherpsnuithaai","CARCHARHINIFORMES","CARCHARHINIDAE","LC","http://www.iucnredlist.org/details/classify/41852/0","http://www.iucnredlist.org/pdflink.41852"
"Rhinoraja longicauda","White-bellied softnose skate, Onagakasube, Witbuikrog","RAJIFORMES","ARHYNCHOBATIDAE","LC","http://www.iucnredlist.org/details/classify/161575/0","http://www.iucnredlist.org/pdflink.161575"
"Urolophus expansus","Wide stingaree, Broadbacked stingaree, Brede doornrog","RAJIFORMES","UROLOPHIDAE","LC","http://www.iucnredlist.org/details/classify/60092/0","http://www.iucnredlist.org/pdflink.60092"
"Narke dipterygia","Numbray, Spottail electric ray, Spottail sleeper ray, Hakuten-shibire-ei, Vlekstaartsluimerrog, Mathan","RAJIFORMES","NARKIDAE","DD","http://www.iucnredlist.org/details/classify/161607/0","http://www.iucnredlist.org/pdflink.161607"
"Apristurus ampliceps","","CARCHARHINIFORMES","SCYLIORHINIDAE","LC","http://www.iucnredlist.org/details/classify/42701/0","http://www.iucnredlist.org/pdflink.42701"
"Squalus acutirostris","Chinese longnose dogfish","SQUALIFORMES","SQUALIDAE","DD","http://www.iucnredlist.org/details/classify/195486/0","http://www.iucnredlist.org/pdflink.195486"
"Anacanthobatis longirostris","Longnose leg skate, Longnose legskate, Langsnuitpootrog","RAJIFORMES","ANACANTHOBATIDAE","DD","http://www.iucnredlist.org/details/classify/161494/0","http://www.iucnredlist.org/pdflink.161494"
"Galeus schultzi","Dwarf sawtail cat shark, dwarf sawtail catshark, Pintarroja enana, Chien nain, Dwergzaagstaartkathaai, Pating","CARCHARHINIFORMES","SCYLIORHINIDAE","DD","http://www.iucnredlist.org/details/classify/161333/0","http://www.iucnredlist.org/pdflink.161333"
"Raja pulchra","Mottled skate, Meganekasube, Geaderde rog","RAJIFORMES","RAJIDAE","VU","http://www.iucnredlist.org/details/classify/161669/0","http://www.iucnredlist.org/pdflink.161669"
"Anacanthobatis folirostris","Bladsnudet lemmerokke, Leaf-nose leg skate, Leafnose legskate, Bladsnuitpootrog","RAJIFORMES","ANACANTHOBATIDAE","DD","http://www.iucnredlist.org/details/classify/161681/0","http://www.iucnredlist.org/pdflink.161681"
"Raja bahamensis","","RAJIFORMES","RAJIDAE","DD","http://www.iucnredlist.org/details/classify/161528/0","http://www.iucnredlist.org/pdflink.161528"
"Potamotrygon orbignyi","Anglespot river stingray, Roughback river stingray, Smooth back river stingray, smooth-back river stingray, Ketjujokirausku, Ruusujokirausku, Liba spari, Engelvlekzoetwaterrog, Gladde zoetwaterrog, Ruwe zoetwaterrog, Spar, Tjoeboela, Raia, Arraia, Arraia cocal, Cachiva","RAJIFORMES","POTAMOTRYGONIDAE","LC","http://www.iucnredlist.org/details/classify/161609/0","http://www.iucnredlist.org/pdflink.161609"
"Himantura toshi","Trnucha Toshova, Sortplettet piskerokke, Black-spotted whipray, Black-edged whipray, Black-spotted stingray, Black-spotted whip ray, Blackspotted whipray, Brown whipray, Coachwhip ray, Ray, Toshs longtail ray, Wulura, Pari tutul, Pari rimau, Pari bintik hitam, Zwartgevlekte pijlstaartrog, Krabane Lai-mang-won","RAJIFORMES","DASYATIDAE","LC","http://www.iucnredlist.org/details/classify/161505/0","http://www.iucnredlist.org/pdflink.161505"
"Dasyatis marmorata","Pylstert, Marmorierter Stechrocen, Marbled stingray, Stingray, Chucho, Irao rantan","RAJIFORMES","DASYATIDAE","DD","http://www.iucnredlist.org/details/classify/161748/0","http://www.iucnredlist.org/pdflink.161748"
"Cephaloscyllium pardelotum","Leopard-spotted swellshark","CARCHARHINIFORMES","SCYLIORHINIDAE","DD","http://www.iucnredlist.org/details/classify/195424/0","http://www.iucnredlist.org/pdflink.195424"
"Himantura undulata","Leopardpiskerokke, Leopard whipray, Bleeker's variegated whipray, Leopard whip ray, honeycomb whipray, ocellate whipray, Pari macan, Pari rimau, Pari batik, Panterpijlstaartrog, Krabane Lai-mang-won","RAJIFORMES","DASYATIDAE","VU","http://www.iucnredlist.org/details/classify/161621/0","http://www.iucnredlist.org/pdflink.161621"
"Etmopterus pycnolepis","Dense-scale lantern shark, Densescale lanternshark, Veelschublantaarnhaai","SQUALIFORMES","ETMOPTERIDAE","DD","http://www.iucnredlist.org/details/classify/63160/0","http://www.iucnredlist.org/pdflink.63160"
"Okamejei arafurensis","","RAJIFORMES","RAJIDAE","LC","http://www.iucnredlist.org/details/classify/195469/0","http://www.iucnredlist.org/pdflink.195469"
"Urolophus paucimaculatus","Sparsely-spotted stingaree, Dixon's stingaree, Dixons stingaree, Ray, White-spotted stingaree, Witgevlekte doornrog","RAJIFORMES","UROLOPHIDAE","LC","http://www.iucnredlist.org/details/classify/60102/0","http://www.iucnredlist.org/pdflink.60102"
"Dasyatis ushiei","Cow stingray, Ushi stingray, Ushi-ei, Koepijlstaartrog","RAJIFORMES","DASYATIDAE","DD","http://www.iucnredlist.org/details/classify/161472/0","http://www.iucnredlist.org/pdflink.161472"
"Hemitriakis japanica","Japanese topeshark, Japanese gray shark, Japanese tope shark, Hemitriakis japanica, Eirakubuka, Haeng-rak-sang-o, Japanse vaalhaai","CARCHARHINIFORMES","TRIAKIDAE","LC","http://www.iucnredlist.org/details/classify/161507/0","http://www.iucnredlist.org/pdflink.161507"
"Rhinoraja murrayi","","RAJIFORMES","ARHYNCHOBATIDAE","NT","http://www.iucnredlist.org/details/classify/161391/0","http://www.iucnredlist.org/pdflink.161391"
"Bythaelurus canescens","dusky catshark, Cat shark, Dusky cat shark, Tollo moteado, Peje gato, Pejegato oscuro, Pintarroja, Tollito, Holbiche sombre, Schemerkathaai","CARCHARHINIFORMES","SCYLIORHINIDAE","DD","http://www.iucnredlist.org/details/classify/61400/0","http://www.iucnredlist.org/pdflink.61400"
"Dipturus doutrei","Rog, Skate, Javalin skate, Javelin skate, Violet skate, Raya violeta, Raie violette, Spiesrog","RAJIFORMES","RAJIDAE","DD","http://www.iucnredlist.org/details/classify/161601/0","http://www.iucnredlist.org/pdflink.161601"
"Schroederichthys maculatus","Narrowtail cat shark, narrowtail catshark, Pejegato rabo fino, Holbiche petite queue, Smalstaartkathaai","CARCHARHINIFORMES","SCYLIORHINIDAE","LC","http://www.iucnredlist.org/details/classify/161544/0","http://www.iucnredlist.org/pdflink.161544"
"Chimaera jordani","Jordans chimaera, Jordan-ginzame","CHIMAERIFORMES","CHIMAERIDAE","DD","http://www.iucnredlist.org/details/classify/60184/0","http://www.iucnredlist.org/pdflink.60184"
"Etmopterus perryi","Lille sorthaj, Dwarf lantern shark, Dwarf lanternshark, Dwerglantaarnhaai","SQUALIFORMES","ETMOPTERIDAE","DD","http://www.iucnredlist.org/details/classify/60240/0","http://www.iucnredlist.org/pdflink.60240"
"Cirrhoscyllium formosanum","Taiwan saddled carpetshark, Taiwan saddled carpet shark, Alfombrera de Taiwan, Taiwaninmattohai, Requin carpette chin, Requin-carpette chin, Taiwanese zadeltapijthaai","ORECTOLOBIFORMES","PARASCYLLIIDAE","DD","http://www.iucnredlist.org/details/classify/161679/0","http://www.iucnredlist.org/pdflink.161679"
"Rhinoraja odai","Oda's skate, Oda skate, Oda-ei","RAJIFORMES","ARHYNCHOBATIDAE","LC","http://www.iucnredlist.org/details/classify/161742/0","http://www.iucnredlist.org/pdflink.161742"
"Dipturus melanospilus","","RAJIFORMES","RAJIDAE","DD","http://www.iucnredlist.org/details/classify/195450/0","http://www.iucnredlist.org/pdflink.195450"
"Psammobatis rutrum","Spade sand skate, Ray, Spade sandskate, Rayita sin orlas, Schepzandrog","RAJIFORMES","ARHYNCHOBATIDAE","DD","http://www.iucnredlist.org/details/classify/63101/0","http://www.iucnredlist.org/pdflink.63101"
"Cruriraja poeyi","Cubansk lemmerokke, Cuban legskate, Cuban leg skate, Poey's limbedskate, Cubaanse pootrog","RAJIFORMES","ANACANTHOBATIDAE","DD","http://www.iucnredlist.org/details/classify/161711/0","http://www.iucnredlist.org/pdflink.161711"
"Somniosus pacificus","Stillehavshavkal, Greenland shark, Pacific sleeper shark, Southern sleeper shark, sleeper shark, Requin dormeur du Pacifique, Laimargue dormeur, Laimargue du Pacifique, Ondenzame, Pacifische ijshaai","SQUALIFORMES","SOMNIOSIDAE","DD","http://www.iucnredlist.org/details/classify/161403/0","http://www.iucnredlist.org/pdflink.161403"
"Urolophus sufflavus","Yellowback stingaree, Geelrugdoornrog","RAJIFORMES","UROLOPHIDAE","VU","http://www.iucnredlist.org/details/classify/60104/0","http://www.iucnredlist.org/pdflink.60104"
"Rhinoptera javanica","Flapneus-rog, Lakhman, Javanese cowray, Cownose ray, Eagle ray, Flapnose ray, Flapray, Javanese cow ray, Javanese cow-nose ray, Javanese cownose ray, Separmahi-e-dopoozeh, Mourine javanaise, Ushibanatobi-ei, Ushibana tobiei, Wagla, Kaka-thirukay, Meithirandi, Bolda, Wagli, Pari burung, Pari ayam, Pari lang, Pari susun, Pari-kelawar Jawa, Javaanse koeneusrog, Valuvadi cownose ray, Valuvadi thirukai, Mayla-cadde, Taa, Valvadi-thirukkai, Yeeson, Banugan, Paging dalimanok, Paging palimanok, Palimanok","RAJIFORMES","RHINOPTERIDAE","VU","http://www.iucnredlist.org/details/classify/60129/0","http://www.iucnredlist.org/pdflink.60129"
"Rhinoptera bonasus","morgath drwynbwl, Kuhkopfrochen, Atlantischer Kuhnasenrochen, kuhnasenrochen, Cownose ray, Cow-nosed ray, Cowfish, Manta, Skeete, cownose rays, Chucho, Cara de vaca, Chucho mono, Gavilan mancha, Gavilan manchado, Mancha, Kurogane-ushibana-tobi-ei, Echte koeneusrog, Raia, Arraia, Raia-focinho-de-vaca, Raia-sapo, Raia-ticonha, Ticonha, Komulerocka, Ndiaouatt, Toumboulann","RAJIFORMES","RHINOPTERIDAE","NT","http://www.iucnredlist.org/details/classify/60128/0","http://www.iucnredlist.org/pdflink.60128"
"Chimaera lignaria","","CHIMAERIFORMES","CHIMAERIDAE","LC","http://www.iucnredlist.org/details/classify/60185/0","http://www.iucnredlist.org/pdflink.60185"
"Rhynchobatus sp. nov. A","","RAJIFORMES","RHYNCHOBATIDAE","VU","http://www.iucnredlist.org/details/classify/60181/0","http://www.iucnredlist.org/pdflink.60181"
"Squalus edmundsi","","SQUALIFORMES","SQUALIDAE","NT","http://www.iucnredlist.org/details/classify/158617/0","http://www.iucnredlist.org/pdflink.158617"
"Etmopterus schultzi","Fringfin lanternshark, Fringefin lantern shark, fringefin lanternshark, Tollo lucero franjeado, Franjevinlantaarnhaai","SQUALIFORMES","ETMOPTERIDAE","LC","http://www.iucnredlist.org/details/classify/60246/0","http://www.iucnredlist.org/pdflink.60246"
"Raja cortezensis","Cortez' rokke, Cortez' ray, Cortez ray, Cortez skate, Ray, Skate, Raya de Cortez, Raie de Cortez, Cortezrog","RAJIFORMES","RAJIDAE","DD","http://www.iucnredlist.org/details/classify/161338/0","http://www.iucnredlist.org/pdflink.161338"
"Mustelus dorsalis","Skarptandet glathaj, Sharpnose smooth hound, Sharp-tooth smooth hound, Sharptooth smoot-hound, Smoothhound, Tollo, Vieja, sharptooth smooth-hound, sharptooth smoothhound, Tollo, Musola blanca, Piruche, Tollo blanco, Vieja, Mustelus dorsalis, Emissole blanche, Scherpsnuittoonhaai","CARCHARHINIFORMES","TRIAKIDAE","DD","http://www.iucnredlist.org/details/classify/44580/0","http://www.iucnredlist.org/pdflink.44580"
"Scylliogaleus quecketti","Flapneus-hondhaai, flapnose houndshark, Huulikoirahai, Scylliogaleus quecketti, Flapsnuitvaalhaai","CARCHARHINIFORMES","TRIAKIDAE","VU","http://www.iucnredlist.org/details/classify/39360/0","http://www.iucnredlist.org/pdflink.39360"
"Dalatias licha","Robhaai, Kalb, Negret xato, Sagrinu neru, morgi gweflog, Chokoladehaj, Darkie charlie, Dunkler Hai, Schokoladenhai, Skylopsaro, Skymnoskylopsaro, kitefin shark, Black shark, Darkie charlie, Kitefm Shark, Seal shark, lija, Carocho, Gata, Gata tramolla, Lija negra, Negrita, Leijahai, Squale liche, Gatte, Liche, Simnus, Drkovna, Zigrino, Cani monicu, Diavolo, Diavulu di funnu, Naire, Neigra, Paddottula, Stire verde, Zegrine, Zigrino negro, Yoroizame, Hiu beurit, Murruna sewda, Zwarte haai, Valse doornhaai, chocoladehaai, Liksa, Gato, Carocho, Gata, Gata-lixa, Lixa de pau, Lixa-de pau, Lixa-de-pau, Negra, Pailona, Peixelim, Trabolha, Peshkagen, Drkovina, Pas mrkalj, Chokladhaj","SQUALIFORMES","DALATIIDAE","NT","http://www.iucnredlist.org/details/classify/6229/0","http://www.iucnredlist.org/pdflink.6229"
"Bathyraja abyssicola","deepsea skate, Deep-sea skate, abyssal skate, Chihirokasube, Diepzeerog","RAJIFORMES","ARHYNCHOBATIDAE","DD","http://www.iucnredlist.org/details/classify/2636/0","http://www.iucnredlist.org/pdflink.2636"
"Dipturus ecuadoriensis","","RAJIFORMES","RAJIDAE","DD","http://www.iucnredlist.org/details/classify/63136/0","http://www.iucnredlist.org/pdflink.63136"
"Squalus brevirostris","Duan wen jiao sha, Shortnose dogfish, Japanese shortnose spurdog, Tsumari-tsuno-zame, Mo-jo-ri-sang-o, Japanse kortsnuitdoornhaai, Kortsnuitdoornhaai","SQUALIFORMES","SQUALIDAE","DD","http://www.iucnredlist.org/details/classify/161438/0","http://www.iucnredlist.org/pdflink.161438"
"Apristurus kampae","Longnose cat shark, longnose catshark, Gato trompudo, Pejegato trompudo, Holbiche tapir, Langsnuitkathaai","CARCHARHINIFORMES","SCYLIORHINIDAE","DD","http://www.iucnredlist.org/details/classify/44215/0","http://www.iucnredlist.org/pdflink.44215"
"Cruriraja rugosa","Ru lemmerokke, Rough leg skate, Rough legskate, Ruwe pootrog","RAJIFORMES","ANACANTHOBATIDAE","DD","http://www.iucnredlist.org/details/classify/161682/0","http://www.iucnredlist.org/pdflink.161682"
"Urolophus orarius","Coastal stingaree, Kustdoornrog","RAJIFORMES","UROLOPHIDAE","EN","http://www.iucnredlist.org/details/classify/60100/0","http://www.iucnredlist.org/pdflink.60100"
"Rhinobatos annulatus","Sandhaai, Banjo, Kleiner sandkruiper, Fanto, Barbar, Geigenrochen, Banjo, Guitarfish, Lesser guitarfish, Lesser sandshark, Sandshark, lesser landshark, Guitarra del Cabo, Rengaskitararausku, Poisson-guitare du Cap, Kleine gitaarrog, Roszak","RAJIFORMES","RHINOBATIDAE","LC","http://www.iucnredlist.org/details/classify/60163/0","http://www.iucnredlist.org/pdflink.60163"
"Etmopterus fusus","","SQUALIFORMES","ETMOPTERIDAE","LC","http://www.iucnredlist.org/details/classify/41808/0","http://www.iucnredlist.org/pdflink.41808"
"Squalus hemipinnis","","SQUALIFORMES","SQUALIDAE","NT","http://www.iucnredlist.org/details/classify/161410/0","http://www.iucnredlist.org/pdflink.161410"
"Pseudocarcharias kamoharai","Krokodilhaai, Krokodillehaj, Krokodilhai, crocodile shark, Japanese ragged-tooth shark, Shark, Water crocodile, Krokotiilihai, Requin crocodile, Requin-crocodile, Mizuwani, Hiu tongar, Krokodilhaai","LAMNIFORMES","PSEUDOCARCHARIIDAE","NT","http://www.iucnredlist.org/details/classify/39337/0","http://www.iucnredlist.org/pdflink.39337"
"Urolophus javanicus","Java stingaree, Javaanse doornrog","RAJIFORMES","UROLOPHIDAE","CR","http://www.iucnredlist.org/details/classify/60095/0","http://www.iucnredlist.org/pdflink.60095"
"Carcharhinus hemiodon","Jarjur, pondicherry shark, Long nosed shark, Carcharhinus hemiodon, Requin baliai, Requin-baliai, Yu punai, Yu, Pondicherryhaai, Pal-sorrah, Chalarm Thao-hoo-dum","CARCHARHINIFORMES","CARCHARHINIDAE","CR","http://www.iucnredlist.org/details/classify/39369/0","http://www.iucnredlist.org/pdflink.39369"
"Hemiscyllium galei","","ORECTOLOBIFORMES","HEMISCYLLIIDAE","DD","http://www.iucnredlist.org/details/classify/195436/0","http://www.iucnredlist.org/pdflink.195436"
"Bathyraja kincaidii","","RAJIFORMES","ARHYNCHOBATIDAE","DD","http://www.iucnredlist.org/details/classify/161706/0","http://www.iucnredlist.org/pdflink.161706"
"Scyliorhinus capensis","Geelspikkel-kathaai, yellowspotted catshark, Dogfish, Lazy shark, Spotted lazyshark, White-spotted dogfish, Yellow-spotted cat shark, Kapinpunahai, Geelgestippelde kathaai","CARCHARHINIFORMES","SCYLIORHINIDAE","NT","http://www.iucnredlist.org/details/classify/39349/0","http://www.iucnredlist.org/pdflink.39349"
"Bathyraja aleutica","Aleutian skate, Arasukakasube, Aleutianrog","RAJIFORMES","ARHYNCHOBATIDAE","LC","http://www.iucnredlist.org/details/classify/161661/0","http://www.iucnredlist.org/pdflink.161661"
"Odontaspis noronhai","Tiefwasser-Sandhai, Bigeye sand tiger, Bigeye sand tiger shark, Bigeye sandtiger, bigeye sand shark, black sand tiger, oceanic sand tiger, Solrayo ojigrande, Ruskohietahai, Requin noronhai, Grootoogzandtijgerhaai, Mangona","LAMNIFORMES","ODONTASPIDIDAE","DD","http://www.iucnredlist.org/details/classify/39336/0","http://www.iucnredlist.org/pdflink.39336"
"Rhinobatos glaucostigma","Speckled guitarfish, Guitarfish, Splaty-spotted guitarfish, Guitarra diablo, Guitarra, Guitarra punteada, Grijsgevlekte gitaarrog","RAJIFORMES","RHINOBATIDAE","DD","http://www.iucnredlist.org/details/classify/161457/0","http://www.iucnredlist.org/pdflink.161457"
"Bathyraja meridionalis","Dark-belly skate, Darkbelly skate, Donkerbuikrog","RAJIFORMES","ARHYNCHOBATIDAE","DD","http://www.iucnredlist.org/details/classify/161619/0","http://www.iucnredlist.org/pdflink.161619"
"Rhinobatos penggali","","RAJIFORMES","RHINOBATIDAE","VU","http://www.iucnredlist.org/details/classify/63166/0","http://www.iucnredlist.org/pdflink.63166"
"Urolophus lobatus","Lobed stingaree, Gelobde doornrog","RAJIFORMES","UROLOPHIDAE","LC","http://www.iucnredlist.org/details/classify/60097/0","http://www.iucnredlist.org/pdflink.60097"
"Raja ackleyi","ocellate skate, raya ocelada, Veeloogrog","RAJIFORMES","RAJIDAE","DD","http://www.iucnredlist.org/details/classify/161446/0","http://www.iucnredlist.org/pdflink.161446"
"Chimaera panthera","Leopard chimaera, Pantterisillikuningas","CHIMAERIFORMES","CHIMAERIDAE","DD","http://www.iucnredlist.org/details/classify/41793/0","http://www.iucnredlist.org/pdflink.41793"
"Dasyatis acutirostra","Sharpnose stingray, Yajiri-ei, Scherpsnuitpijlstaartrog","RAJIFORMES","DASYATIDAE","NT","http://www.iucnredlist.org/details/classify/60147/0","http://www.iucnredlist.org/pdflink.60147"
"Rajella dissimilis","Geister-Tiefwasserrochen, Ghost skate, Geestrog","RAJIFORMES","RAJIDAE","LC","http://www.iucnredlist.org/details/classify/44651/0","http://www.iucnredlist.org/pdflink.44651"
"Halaelurus lineatus","Band-kathaai, Banded catshark, Lined cat shark, lined catshark, Pejegato playero, Holbiche des plages, Lijnkathaai, Pata-roxa lineada","CARCHARHINIFORMES","SCYLIORHINIDAE","DD","http://www.iucnredlist.org/details/classify/44612/0","http://www.iucnredlist.org/pdflink.44612"
"Parmaturus lanatus","","CARCHARHINIFORMES","SCYLIORHINIDAE","DD","http://www.iucnredlist.org/details/classify/161450/0","http://www.iucnredlist.org/pdflink.161450"
